{
  "status": "example_status",
  "deleted_at": "2024-06-15T12:00:00Z",
  "created_at": "2024-06-15T12:00:00Z",
  "updated_at": "2024-06-15T12:00:00Z",
  "id": "550e8400-e29b-41d4-a716-446655440000",
  "identifier": "example_tifier",
  "description": "example_iption",
  "validFrom": "2024-06-15T12:00:00Z",
  "validTo": "2024-06-15T12:00:00Z",
  "area": "example_l-area",
  "hasIrrigationFlow": "example_onFlow",
  "category": "example_tegory",
  "inRegion": "example_Region",
  "hasToponym": "example_oponym",
  "isNitroArea": true,
  "isNatura2000Area": true,
  "isPdopgArea": true,
  "isIrrigated": true,
  "isCultivatedInLevels": true,
  "isGroundSlope": true,
  "depiction": "example_iction",
  "hasGeometry": "example_ometry",
  "location": "example_cation",
  "hasAgriCrop": [],
  "farm": "550e8400-e29b-41d4-a716-446655440000"
}